{"adapter_id":"fixture.exact_state.contract","profile_id":"fixture-v1","rows":[{"acceptance_ids":["CK-002"],"capture_method":"canonical value","field_group":"contract_fixture_marker","ordering":"not_applicable","phase":"CONTRACT_FIXTURE","rationale":"Illustrates the coverage row shape; not a game field.","restore_method":"not_applicable_fixture","source_symbol":"fixtures/exact_state_v1/fixture_marker","status":"captured","visibility":"privileged"},{"acceptance_ids":["CK-004"],"capture_method":"excluded","field_group":"administrative_provenance","ordering":"not_applicable","phase":"all","rationale":"Run IDs, timestamps, and labels never enter exact state.","restore_method":"excluded","source_symbol":"n/a","status":"excluded_nonsemantic","visibility":"public"}],"schema":"ascension.coverage_contract.v1"}
